{
  "schemaVersion": "0.1.0",
  "project": { "id": "disconnected-target", "name": "Disconnected Target" },
  "startSpaceId": "start",
  "targetSpaceIds": ["exit"],
  "spaces": {
    "start": { "id": "start", "name": "Start" },
    "exit": { "id": "exit", "name": "Exit" }
  },
  "connections": {},
  "gates": {},
  "tokens": {},
  "puzzles": {},
  "beats": {}
}
