{
  "schemaVersion": "0.1.0",
  "project": {
    "id": "maze-disconnected-target",
    "name": "maze-disconnected-target"
  },
  "startSpaceId": "s0",
  "targetSpaceIds": ["exit"],
  "spaces": {
    "s0": { "id": "s0", "name": "Space 0" },
    "s1": { "id": "s1", "name": "Space 1" },
    "s2": { "id": "s2", "name": "Space 2" },
    "s3": { "id": "s3", "name": "Space 3" },
    "s4": { "id": "s4", "name": "Space 4" },
    "s5": { "id": "s5", "name": "Space 5" },
    "s6": { "id": "s6", "name": "Space 6" },
    "exit": { "id": "exit", "name": "Exit" }
  },
  "connections": {
    "s-last-exit": {
      "id": "s-last-exit",
      "fromSpaceId": "s6",
      "toSpaceId": "exit"
    }
  },
  "gates": {},
  "tokens": {},
  "puzzles": {},
  "beats": {}
}
