{
  "schemaVersion": "0.1.0",
  "project": { "id": "key-behind-own-gate", "name": "Key Behind Own Gate" },
  "startSpaceId": "start",
  "targetSpaceIds": ["locked"],
  "spaces": {
    "start": { "id": "start", "name": "Start" },
    "locked": { "id": "locked", "name": "Locked" }
  },
  "connections": {
    "start-locked": {
      "id": "start-locked",
      "fromSpaceId": "start",
      "toSpaceId": "locked",
      "gateId": "gate"
    }
  },
  "gates": {
    "gate": { "id": "gate", "name": "Gate", "kind": "lock", "requiredTokenIds": ["key"] }
  },
  "tokens": { "key": { "id": "key", "name": "Key", "kind": "item", "locationSpaceId": "locked" } },
  "puzzles": {},
  "beats": {}
}
