{
  "schemaVersion": "0.1.0",
  "project": { "id": "horror-flat-timeline", "name": "horror-flat-timeline" },
  "startSpaceId": "s0",
  "targetSpaceIds": ["exit"],
  "spaces": {
    "s0": { "id": "s0", "name": "Space 0" },
    "s1": { "id": "s1", "name": "Space 1" },
    "s2": { "id": "s2", "name": "Space 2" },
    "s3": { "id": "s3", "name": "Space 3" },
    "s4": { "id": "s4", "name": "Space 4" },
    "s5": { "id": "s5", "name": "Space 5" },
    "s6": { "id": "s6", "name": "Space 6" },
    "exit": { "id": "exit", "name": "Exit" }
  },
  "connections": {
    "s0-s1": {
      "id": "s0-s1",
      "fromSpaceId": "s0",
      "toSpaceId": "s1",
      "directed": false
    },
    "s1-s2": {
      "id": "s1-s2",
      "fromSpaceId": "s1",
      "toSpaceId": "s2",
      "directed": false
    },
    "s2-s3": {
      "id": "s2-s3",
      "fromSpaceId": "s2",
      "toSpaceId": "s3",
      "directed": false
    },
    "s3-s4": {
      "id": "s3-s4",
      "fromSpaceId": "s3",
      "toSpaceId": "s4",
      "directed": false
    },
    "s4-s5": {
      "id": "s4-s5",
      "fromSpaceId": "s4",
      "toSpaceId": "s5",
      "directed": false
    },
    "s5-s6": {
      "id": "s5-s6",
      "fromSpaceId": "s5",
      "toSpaceId": "s6",
      "directed": false
    },
    "s-last-exit": {
      "id": "s-last-exit",
      "fromSpaceId": "s6",
      "toSpaceId": "exit"
    }
  },
  "gates": {},
  "tokens": {},
  "puzzles": {},
  "beats": {
    "a": {
      "id": "a",
      "name": "A",
      "kind": "discovery",
      "intensity": 0.51,
      "order": 1
    },
    "b": {
      "id": "b",
      "name": "B",
      "kind": "threat",
      "intensity": 0.5,
      "order": 2
    },
    "c": {
      "id": "c",
      "name": "C",
      "kind": "puzzle",
      "intensity": 0.52,
      "order": 3
    }
  }
}
