{
  "schemaVersion": "0.1.0",
  "project": { "id": "gated-token-chain", "name": "Gated Token Chain" },
  "startSpaceId": "start",
  "targetSpaceIds": ["exit"],
  "spaces": {
    "start": { "id": "start", "name": "Start" },
    "key-room": { "id": "key-room", "name": "Key Room" },
    "exit": { "id": "exit", "name": "Exit" }
  },
  "connections": {
    "start-key-room": { "id": "start-key-room", "fromSpaceId": "start", "toSpaceId": "key-room" },
    "key-room-exit": {
      "id": "key-room-exit",
      "fromSpaceId": "key-room",
      "toSpaceId": "exit",
      "gateId": "key-gate"
    }
  },
  "gates": {
    "key-gate": {
      "id": "key-gate",
      "name": "Key Gate",
      "kind": "lock",
      "requiredTokenIds": ["key"]
    }
  },
  "tokens": {
    "key": { "id": "key", "name": "Key", "kind": "item", "locationSpaceId": "key-room" }
  },
  "puzzles": {},
  "beats": {}
}
